record_id,language_code,language_name,script_note,source,title,pageid,paragraph_index,chars,cyrillic_ratio,vertical_mongolian_ratio,latin_ratio,url,text
da08e5a301f5aab2,mn,蒙古语,mn.wikipedia.org 主要为西里尔蒙古文，非传统竖排蒙古文,wikipedia_api,Өгэдэй хаан,1914,8,590,0.8322,0.0,0.0,https://mn.wikipedia.org/wiki/%D3%A8%D0%B3%D1%8D%D0%B4%D1%8D%D0%B9_%D1%85%D0%B0%D0%B0%D0%BD,"Түүний сэтгэл татам зан байдлын тухай мэдээллүүдийг үл харгалзан 1237 онд үйлдсэн гэмт хэргийнх нь төлөө Монгол, Персийн түүхчид Өгэдэйг шүүмжилсэн байдаг ба энэ нь Персийн түүхчдийн бичсэнээр долоогоос дээш насны 4,000 ойрад охидыг хүчирхийлэх тушаалаас бүрддэг. Тэгээд дараа нь эдгээр охид Өгэдэйн гаремд (эмсийн байр) хураагдах, эсвэл Монголын эзэнт гүрэн даяарх аяны буудлуудад биеэ үнэлэгчид болон хэрэглэгдэхээр өгөгдсөн байна. Өмнө нь Ойрад нутгийг захирч байсан Өгэдэйн эгч Чэчэйхэний үхлийн дараах энэ алхам нь Ойрад аймаг болон тэдний газар нутгийг Өгэдэйн хяналтын доор авчирчээ."
68ed153b7586fd69,mn,蒙古语,mn.wikipedia.org 主要为西里尔蒙古文，非传统竖排蒙古文,wikipedia_api,Өгэдэй хаан,1914,9,518,0.7934,0.0,0.0309,https://mn.wikipedia.org/wiki/%D3%A8%D0%B3%D1%8D%D0%B4%D1%8D%D0%B9_%D1%85%D0%B0%D0%B0%D0%BD,Хорезмын эзэнт гүрнийг устгасны дараа Чингис хаан Тангуд улсын эсрэг хөдлөхөд чөлөөтэй болсон. Гэсэн хэдий ч 1226 онд Хорезмын хаадын сүүлчийнх нь болох Желал ад-Дин Мангуберди өөрийн эцэг II Ала ад-Дин Мухаммедын алдсан эзэнт гүрнийг сэргээхээр Персэд буцаж иржээ. 1227 онд түүний эсрэг илгээсэн Монголын зэвсэгт хүчин Дамганд ялагдсан байна. Желал ад-Динийн эсрэг хөдөлсөн өөр нэг арми Исфаханы ойролцоо пиррийн ялалт (pyrrhic victory - ялагдсантай адил ялалт) байгуулсан боловч тэр амжилтаа үргэлжлүүлж чадаагүй аж.
9cee153c449c177e,mn,蒙古语,mn.wikipedia.org 主要为西里尔蒙古文，非传统竖排蒙古文,wikipedia_api,Өгэдэй хаан,1914,10,782,0.8286,0.0,0.0,https://mn.wikipedia.org/wiki/%D3%A8%D0%B3%D1%8D%D0%B4%D1%8D%D0%B9_%D1%85%D0%B0%D0%B0%D0%BD,"Өгэдэй дайны ажиллагаа эхлүүлэхийг зөвшөөрснөөр Чормаган хорчи 30,000-50,000 монгол цэргийг толгойлон Бухараас гарчээ. Тэрээр хорезмуудын тусламж дэмжлэгийн удаан хугацааны хоёр бааз суурь болох Хорасан, Персийг эзлэн авав. 1230 онд Амударья мөрнийг гаталсан ба ямар нэгэн эсэргүүцэлтэй тулгаралгүйгээр Хорасан руу орсон тул Чормаган хурдан, чөлөөтэй явж өнгөрлөө. Тэрээр баруун Афганистан руу довтлох цаашдын зааврыг өгсөн байсан Дайр баатрын хяналт доор бие бүрэлдэхүүнийхээ нэлээд их хэсгийг дэмжлэг болгон үлдээжээ. Чормаган болон түүний армийн олонх хэсэг 1230 оны намар Эльбурсын уулс болон Каспийн тэнгисийн хоорондох бүс нутаг Табаристан (орчин үеийн Мазендеран) руу орж, ингэснээр Низаритын исмайлитуудын (ассасинууд) хяналтад байсан өмнө зүг дэх уулархаг бүсээс зайлсхийв."
934e4a507143c73d,mn,蒙古语,mn.wikipedia.org 主要为西里尔蒙古文，非传统竖排蒙古文,wikipedia_api,Өгэдэй хаан,1914,11,751,0.8402,0.0,0.0,https://mn.wikipedia.org/wiki/%D3%A8%D0%B3%D1%8D%D0%B4%D1%8D%D0%B9_%D1%85%D0%B0%D0%B0%D0%BD,"Рей хотод хүрээд Чормаган өвлийн хүрээгээ тэнд байгуулсан ба хойд Персийн үлдсэн хэсгийг номхотгохын тулд цэргүүдээ илгээжээ. 1231 онд тэр өөрийн удирдсан армийг өмнө зүг рүү хөдөлгөсөн бөгөөд Кум, Хамадан хотууд хурдан хугацаанд эзлэгдэв. Тэндээс тэрээр Фарс, Керманы бүс нутгууд руу цэргүүдээ илгээхэд тэдгээрийн захирагчид мужуудаа сүйтгүүлж байхаас илүү Монгол эздэд алба гувчуур төлөхийг эрхэмлэн хурдан хугацаанд дагаар орлоо. Энэ хооронд зүүн зүгт Дайр баатар Кабул, Газни, Забулистаныг эзлэх зорилгодоо гуйвалтгүй хүрч байв. Монголчууд аль хэдийн Персэд дэг журам тогтоосон тул Желал ад-Дин хөөгдөхөд хүрч, Өвөр Кавказад тусгаарлагдсан байна (тэрээр энэ явдлаас хойш удалгүй алагджээ). Ийнхүү Перс бүхэлдээ Монголын эзэнт гүрэнд нэгдсэн болой."
582c8717e4ee64c8,mn,蒙古语,mn.wikipedia.org 主要为西里尔蒙古文，非传统竖排蒙古文,wikipedia_api,Өгэдэй хаан,1914,12,1009,0.8256,0.0,0.0,https://mn.wikipedia.org/wiki/%D3%A8%D0%B3%D1%8D%D0%B4%D1%8D%D0%B9_%D1%85%D0%B0%D0%B0%D0%BD,"1230 оны сүүлээр Доголху чэрби (монгол жанжин) Алтан улсад санамсаргүй байдлаар ялагдсаны хариуд Өгэдэй хаан дүү Толуйн хамт өмнө зүгт Шаньси муж руу хөдлөн уг мужийг Алтан улсын цэргээс цэвэрлэж, Фынсян хотыг эзлэн авав. Хойд зүгт зуны улирлыг өнгөрөөсний дараа тэд Хэнань дахь Алтан улсын хүчний эсрэг дахин дайны ажиллагаа явуулсан бөгөөд Алтан улсын ар талаас довтлохын тулд Өмнөд Хятадын нутгаар (Сүн улсын газар нутгаар) дайран гарчээ. 1232 он гэхэд Алтан улсын хаан нийслэл Кайфын хотдоо бүслэгдсэн байлаа. Удалгүй Өгэдэй аян дайны эцсийг өөрийн жанждад даатгаж үлдээгээд буцав. Хэд хэдэн хотыг эзэлсний дараа монголчууд Сүн улсын хожимдсон тусламжаар 1234 оны хоёрдугаар сард Цайчжоу хотыг эзлэн авч (Алтан улсын хаан Кайфын хотоос явж Цайчжоу хотод орогноод байжээ) Алтан улсыг мөхөөжээ. Гэвч дараа нь Сүн улсын амбан захирагч Монголын элч төлөөлөгчийг хороосон бөгөөд Сүн улсын цэргүүд монголчуудын захиргаанд байсан Сүн улсын урьдын нийслэлүүд болох Кайфын, Лоян, Чанань\ зэрэг хотуудыг эзэлж авав."
5d67ab2f529a29b3,mn,蒙古语,mn.wikipedia.org 主要为西里尔蒙古文，非传统竖排蒙古文,wikipedia_api,Өгэдэй хаан,1914,13,290,0.8034,0.0,0.0,https://mn.wikipedia.org/wiki/%D3%A8%D0%B3%D1%8D%D0%B4%D1%8D%D0%B9_%D1%85%D0%B0%D0%B0%D0%BD,"Алтан улстай хийсэн дайнаас гадна Өгэдэй Пусянь Ваньну (урьд нь Алтан улсын жанжин байсан) гэгчийн байгуулсан Дорнод Ся улсыг 1233 онд бут цохин мөхөөж, өмнөд Манжуурыг төвшитгөжээ. Мөн энэ бүс нутгийн хойд хэсэгт орших Усны татаруудыг номхотгож, 1237 онд гаргасан бослогыг нь дарсан байна."
d177cfe350d32120,mn,蒙古语,mn.wikipedia.org 主要为西里尔蒙古文，非传统竖排蒙古文,wikipedia_api,Өгэдэй хаан,1914,14,1258,0.8243,0.0,0.0,https://mn.wikipedia.org/wiki/%D3%A8%D0%B3%D1%8D%D0%B4%D1%8D%D0%B9_%D1%85%D0%B0%D0%B0%D0%BD,"1232 онд Чормаганы удирдсан монголчууд Кавказад эргэж ирэв. 1235 онд Гянжа хотын хэрмийг оньсон харвах, түншүүр зэвсгээр эвдэн нураажээ. Эрбиль хотын иргэд Монгол хааны ордонд жил бүр алба гувчуур хүргэхээр тохиролцсоны эцэст монголчууд ухарсан байна. Чормаган 1238 он хүртэл, өөрөөр хэлбэл ханхүү Мөнхийн цэргийн хүч Хойд Кавказад идэвхтэй үйл ажиллагаа явуулах хүртэл хүлээв (1236 оноос Бат хааны удирдсан Монголын их цэрэг Европ руу цөмрөн аян дайн хийж эхэлсэн бөгөөд энэ аян дайны үеэр ханхүү Мөнх, Хадан нар Хойд Кавказын овог аймгуудыг байлдан дагуулсан байна). Арменийг эрхшээлдээ оруулсныхаа дараа Чормаган Тбилиси хотыг эзлэн авлаа. 1238 онд монголчууд Лори хотыг эзлэв. Хотын захирагч шахиншах нь монголчуудыг ирэхээс өмнө гэр бүлийнхээ хамт зугтаж, энэхүү баян хотыг хувь заяанд нь даатгаж үлдээсэн аж. Хоханаберд цайз хүчтэй эсэргүүцэл үзүүлсний дараа цайзын захирагч Гасан Жалал монголчуудад дагаар оров. Дараа нь монголчууд Гүржийн өөр нэгэн түшиг тулгуур болох атабек Авагийн захирсан Каен цайзын эсрэг хөдөлжээ. Монгол жанжин Тохта шууд дайралт хийлгүй, хотыг тойруулан хана хэрэм босгосон тул Аваг удалгүй бууж өглөө. 1240 он гэхэд Чормаган Өмнөд Кавказыг байлдан дагуулж дууссан бөгөөд ингэснээрээ Гүржийн язгууртнуудыг бууж өгөхөд хүргэв."
fa5304f5b00c5c5c,mn,蒙古语,mn.wikipedia.org 主要为西里尔蒙古文，非传统竖排蒙古文,wikipedia_api,Өгэдэй хаан,1914,15,824,0.8265,0.0,0.0,https://mn.wikipedia.org/wiki/%D3%A8%D0%B3%D1%8D%D0%B4%D1%8D%D0%B9_%D1%85%D0%B0%D0%B0%D0%BD,"1224 онд Солонгост очсон Монголын элч буцах замдаа тодорхой бус байдлаар алагдаж, Солонгосын эрх баригчид Монголд албан татвар өгөхөө больжээ. 1231 онд Өгэдэй үрэгдсэн элчийнхээ өшөөг авах, Солонгосыг дарангуйлах зорилгоор Саритай хорчийг илгээв. Ингээд энэ хаант улсыг дарангуйлах тушаалын дагуу Монголын цэрэг Солонгос руу довтолж эхэллээ. Корё улсын (тухайн үед Солонгост оршин тогтнож байсан улс) хаан Монголын даргач нарыг хүлээн авахаар тохиролцсон бөгөөд тэд нараар улс орныхоо хэргийг түр хугацаанд мэдүүлэв. Гэвч тэднийг 1232 оны зун буцахад Чхве У (тухайн үед Корё улсад цэргийн дэглэм тогтож, цэргийн эрхтнүүд улс орныг удирдаж байсан бөгөөд энэ үеийн цэргийн дэглэмийн удирдагч нь Чхве У байв) нийслэлээ Кэсоноос Канхва арал руу нүүлгэжээ. Саритай тэдний эсрэг дайн хийж байгаад тэнэсэн суманд өртөж амь үрэгдэв."
65fcb8cdab40c0c3,mn,蒙古语,mn.wikipedia.org 主要为西里尔蒙古文，非传统竖排蒙古文,wikipedia_api,Өгэдэй хаан,1914,16,633,0.8057,0.0,0.0079,https://mn.wikipedia.org/wiki/%D3%A8%D0%B3%D1%8D%D0%B4%D1%8D%D0%B9_%D1%85%D0%B0%D0%B0%D0%BD,"1234 онд Монголд болсон их хуралдай дээр Өгэдэй Монголын элч нарыг хороосон солонгосчууд, Өмнөд Сүн улс, кипчакууд болон тэдний Европын холбоотнуудыг байлдан дагуулах төлөвлөгөөгөө зарлалаа. Өгэдэй Монгол цэргийн жанжнаар Данхыг (Danqu) томилж, дагаар орсон солонгос жанжин Хон Бок-воныг Корё улсаас эзэлж авсан дагасан цэрэг, иргэд бүхий 40 хотын захирагч болгов. 1238 онд Корё улсын хааны ордон энх тайвныг тогтоохыг хүсэхэд Өгэдэй Корё улсын хааныг өөрийн биеэр Монголд ирэхийг шаарджээ. Корё улсын хаан эцэстээ өөрийн хамаатан Ён Нон-гун Суныг сурвалжит 10 хөвгүүний хамт Монгол руу барьцаанд илгээснээр 1241 онд дайн түр зогсов."
6b574ad6d7b04968,mn,蒙古语,mn.wikipedia.org 主要为西里尔蒙古文，非传统竖排蒙古文,wikipedia_api,Өгэдэй хаан,1914,17,546,0.8187,0.0,0.0,https://mn.wikipedia.org/wiki/%D3%A8%D0%B3%D1%8D%D0%B4%D1%8D%D0%B9_%D1%85%D0%B0%D0%B0%D0%BD,"Монголын эзэнт гүрэн өрнө зүгийн тал хээр нутгийн (Кипчакийн тал нутаг) нүүдэлчдийг эрхшээлдээ оруулж, Европ руу хөөх зорилгоор Бат хааны удирдлага доор баруун зүгт өргөжин тэлж эхлэв. Тэд баруун зүгийн байлдан дагууллаараа Ижил мөрний Булгар, Аланы бараг бүх хэсэг, Кипчакийн тал нутаг, Оросыг эзлэн авснаас гадна Унгарыг богино хугацаанд эзэлсэн юм. Тэд бас Польш, Хорват, Серби, Болгар, Латины эзэнт гүрэн, Австри руу довтолжээ. Коломнагийн (Оросын хот) бүслэлтийн үеэр Өгэдэй хааны эцэг нэгт ах (дүү?) Хүлгэн суманд оногдож амиа алдсан байна."
01b76b4b6883b003,mn,蒙古语,mn.wikipedia.org 主要为西里尔蒙古文，非传统竖排蒙古文,wikipedia_api,Өгэдэй хаан,1914,18,636,0.8208,0.0,0.0,https://mn.wikipedia.org/wiki/%D3%A8%D0%B3%D1%8D%D0%B4%D1%8D%D0%B9_%D1%85%D0%B0%D0%B0%D0%BD,"Энэ аян дайны үеэр Өгэдэйн хүү Гүюг, Цагадайн ач Бүри нар Батыг тохуурхан доромжилж, монголчуудын хүрээнд зөрчил үүсэв. Өгэдэй хаан Гүюгийг ""Чи өөрийн армийн эр хүн бүрийн санаа сэтгэлийг алдагдуулсан... Чамайг өөрийнхөө эрчүүдэд харгис хандаж байснаас болж оросууд бууж өгсөн гэж бодож байна уу?"" (""Аялж одруун зуур бөгст хүний бөгс нь эс үлдэв хэмээгдэмү чи... Оросууд иргэнийг тэр чиний уур хилэнд айж орогдсоноо болгон ахуюу чи"") хэмээн хатуу зэмлэжээ. Дараа нь тэр Европыг байлдан дагуулах ажиллагааг үргэлжлүүлэхээр Гүюгийг буцаан илгээсэн байна. Гүюг болон Өгэдэйн өөр нэг хүү Хадан нар Трансильвани, Польш руу тус тус довтолжээ."
ac6b6b1e138c041a,mn,蒙古语,mn.wikipedia.org 主要为西里尔蒙古文，非传统竖排蒙古文,wikipedia_api,Өгэдэй хаан,1914,19,745,0.8322,0.0,0.0,https://mn.wikipedia.org/wiki/%D3%A8%D0%B3%D1%8D%D0%B4%D1%8D%D0%B9_%D1%85%D0%B0%D0%B0%D0%BD,"Хэдийгээр Өгэдэй хаан Европын үлдсэн хэсэг рүү, ""Их тэнгис"" - Атлантын далай хүртэл довтлох зөвшөөрөл олгосон байсан боловч түүнийг нас барсны дараах жил буюу 1242 оны эхээр монголчуудын давшилт Зүүн Европт зогссон юм. Монгол суртал ухуулга хожим энэ аян дайны бүтэлгүйтлийг түүний цаг бусаар нас барсантай холбон тайлбарлаж, Өгэдэйн залгамжлагчийг сонгоход Бат биечлэн оролцох ёстой байсан гэх болно. Гэвч үнэндээ Бат хэзээ ч ийм сонгуулийн төлөө Монгол руу буцаж ирээгүй бөгөөд 1246 он хүртэл залгамжлагч тодроогүй юм. Европын цайз бэхлэлтүүд стратегийн хувьд асуудал үүсгэж, монгол жанжид байгаа нөөц бололцоогоороо түүнийг даван туулж чадахгүй байсан явдал нь аян дайн зогсонги байдалд орж, дахин сэргээгүйн шалтгаан болсон байх магадлалтай."
dc432a7e340e3d25,mn,蒙古语,mn.wikipedia.org 主要为西里尔蒙古文，非传统竖排蒙古文,wikipedia_api,Өгэдэй хаан,1914,20,553,0.8029,0.0,0.0108,https://mn.wikipedia.org/wiki/%D3%A8%D0%B3%D1%8D%D0%B4%D1%8D%D0%B9_%D1%85%D0%B0%D0%B0%D0%BD,"1235-1245 оны үед Өгэдэйн хөвгүүдээр удирдуулан хийсэн ихээхэн хор хөнөөлтэй цуврал довтолгооныхоо үр дүнд монголчууд Сүн улсын нутгийн гүнд нэвтэрч, Чэнду, Сянъян, Хөх мөрөнд хүрчээ. Гэвч тэд газар орны уур амьсгал, Сүн улсын цэргийн тоо зэргээс шалтгаалан аян дайнаа амжилттай дуусгаж чадаагүй бөгөөд энэ дайны явцад Өгэдэйн хүү Хүчү амь үрэгдсэн байна. 1240 онд Өгэдэйн нөгөө хүү Хүдэн туслах чанартай армийг Төвд рүү илгээжээ. Сүн улсын түшмэлүүд Сэлмүс (Selmus) тэргүүтэй Өгэдэйн элч нарыг хөнөөснөөр хоёр улсын хоорондох нөхцөл байдал улам дордов."
3e43040237a5cd3b,mn,蒙古语,mn.wikipedia.org 主要为西里尔蒙古文，非传统竖排蒙古文,wikipedia_api,Өгэдэй хаан,1914,21,209,0.8421,0.0,0.0,https://mn.wikipedia.org/wiki/%D3%A8%D0%B3%D1%8D%D0%B4%D1%8D%D0%B9_%D1%85%D0%B0%D0%B0%D0%BD,"Өгэдэйн удирдлага доор Ази тив даяар явагдсан Монгол гүрний өргөжин тэлэлт нь улс төрийн тогтвортой байдлыг авчирч, Өрнө ба Дорныг холбосон худалдааны гол зам болох Торгоны замыг дахин сэргээхэд тус болсон юм."
231ef87493d5f2b3,mn,蒙古语,mn.wikipedia.org 主要为西里尔蒙古文，非传统竖排蒙古文,wikipedia_api,Өгэдэй хаан,1914,22,356,0.7697,0.0,0.0225,https://mn.wikipedia.org/wiki/%D3%A8%D0%B3%D1%8D%D0%B4%D1%8D%D0%B9_%D1%85%D0%B0%D0%B0%D0%BD,"Өгэдэй Газнид Дайр баатрыг, Кундузад Мэнгэт (Menggetu) ноёныг тус тус захирагчаар томилжээ. 1241 оны өвөл монгол цэргүүд Инд мөрний хөндий рүү довтолж, Делийн султант улсын мэдэлд байсан Лахор хотыг бүслэв. Гэвч Дайр баатар 1241 оны 12-р сарын 30-нд хот руу дайрах үеэр амь үрэгдсэн ба монголчууд Делийн султант улсаас гарахаасаа өмнө хотыг эвдэн устгажээ."
d768fb3fe1bef955,mn,蒙古语,mn.wikipedia.org 主要为西里尔蒙古文，非传统竖排蒙古文,wikipedia_api,Өгэдэй хаан,1914,23,264,0.8144,0.0,0.0,https://mn.wikipedia.org/wiki/%D3%A8%D0%B3%D1%8D%D0%B4%D1%8D%D0%B9_%D1%85%D0%B0%D0%B0%D0%BD,"1235 оноос хойш хэсэг хугацааны дараа монгол цэргийн өөр нэг хүч Кашмир руу довтолж, тэнд хэдэн жил даргач суулгав. Удалгүй Кашмир Монголын хараат болжээ. Ойролцоогоор тэр үед Кашмирын буддын шашны их багш Оточи болон түүний ах Намо нар Өгэдэйн ордонд ирсэн байна."
b7853d10f767e417,mn,蒙古语,mn.wikipedia.org 主要为西里尔蒙古文，非传统竖排蒙古文,wikipedia_api,Өгэдэй хаан,1914,24,112,0.8482,0.0,0.0,https://mn.wikipedia.org/wiki/%D3%A8%D0%B3%D1%8D%D0%B4%D1%8D%D0%B9_%D1%85%D0%B0%D0%B0%D0%BD,Өгэдэй Монголын засаг захиргааны хүнд суртлыг бий болгожээ. Түүний захиргааг гурван бүлэг бүрдүүлсэн. Эдгээр нь:
09c49cecfbebe7a8,mn,蒙古语,mn.wikipedia.org 主要为西里尔蒙古文，非传统竖排蒙古文,wikipedia_api,Өгэдэй хаан,1914,25,75,0.88,0.0,0.0,https://mn.wikipedia.org/wiki/%D3%A8%D0%B3%D1%8D%D0%B4%D1%8D%D0%B9_%D1%85%D0%B0%D0%B0%D0%BD,Уйгур бичээч Чингай болон хэрэйдүүд төлөөлсөн христ шүтлэгт дорнод түрэгүүд
819e8effac05f2fc,mn,蒙古语,mn.wikipedia.org 主要为西里尔蒙古文，非传统竖排蒙古文,wikipedia_api,Өгэдэй хаан,1914,26,160,0.8375,0.0,0.0,https://mn.wikipedia.org/wiki/%D3%A8%D0%B3%D1%8D%D0%B4%D1%8D%D0%B9_%D1%85%D0%B0%D0%B0%D0%BD,"Хорезм хүмүүс болох Махмуд Ялавач, Масуд-бек нар төлөөлсөн лалын шашинтнууд (Лалын шашинтнууд Монголын төрд олон үеэрээ зүтгэж байсны нэг нь энэ үеийнхэн болно)"
82a6f2bd0301e58b,mn,蒙古语,mn.wikipedia.org 主要为西里尔蒙古文，非传统竖排蒙古文,wikipedia_api,Өгэдэй хаан,1914,27,102,0.8627,0.0,0.0,https://mn.wikipedia.org/wiki/%D3%A8%D0%B3%D1%8D%D0%B4%D1%8D%D0%B9_%D1%85%D0%B0%D0%B0%D0%BD,"Хятан үндэстэн Елюй Чуцай, зүрчин үндэстэн Няньхэ Чжуншань нар төлөөлсөн күнзийн сурталт хойд хятадууд"
