record_id,language_code,language_name,script_note,source,title,pageid,paragraph_index,chars,cyrillic_ratio,vertical_mongolian_ratio,latin_ratio,url,text
f5787257512dac77,mn,蒙古语,mn.wikipedia.org 主要为西里尔蒙古文，非传统竖排蒙古文,wikipedia_api,Өгэдэй хаан,1914,28,793,0.86,0.0,0.0,https://mn.wikipedia.org/wiki/%D3%A8%D0%B3%D1%8D%D0%B4%D1%8D%D0%B9_%D1%85%D0%B0%D0%B0%D0%BD,"Махмуд Ялавач төр засгийн зүгээс татвар хураах ажлыг мөнгөөр төлбөр төлдөг татварын фермерүүдэд хариуцуулах тогтолцоог сурталчилж байжээ. Елюй Чуцай төр засгийн уламжлалт хятад хэв маяг бүхий тогтолцоог бий болгох тал дээр Өгэдэйд дэмжлэг үзүүлж байсан бөгөөд татварыг төрийн албаны төлөөлөгчдийн гарт шилжүүлж, засаг төрийн гаргасан мөнгөн тэмдэгтээр төлбөр хийдэг байв. Лал худалдаачид Монголын язгууртнуудын хувь нийлүүлсэн хөрөнгөөр ажиллаж, татвар төлөхөд шаардлагатай мөнгийг өндөр хүүтэй зээлж байжээ. Ялангуяа Өгэдэй эдгээр ортог (Монголын эзэнт гүрний үед төр ба хувь язгууртнуудын түнш худалдаачныг ийн нэрлэж байжээ) аж ахуйн нэгжүүдэд идэвхтэй хөрөнгө оруулалт хийсэн байна. Үүний зэрэгцээ монголчууд мөнгөний нөөцөөр баталгаажсан цаасан мөнгөн тэмдэгтийг гүйлгээнд оруулж эхэлжээ."
cf61021c42b787ab,mn,蒙古语,mn.wikipedia.org 主要为西里尔蒙古文，非传统竖排蒙古文,wikipedia_api,Өгэдэй хаан,1914,29,1150,0.8391,0.0,0.0,https://mn.wikipedia.org/wiki/%D3%A8%D0%B3%D1%8D%D0%B4%D1%8D%D0%B9_%D1%85%D0%B0%D0%B0%D0%BD,"Өгэдэй төрийн хэрэг эрхлэх салбар хэлтсүүдийг татан буулгаж, Елюй Чуцайн санал болгосны дагуу Монголын захиргаан дахь Хятадын газар нутгийг 10 замд хуваасан ажээ. Мөн тэрээр эзэнт гүрнийг Бешбалык ба Яньцзингийн засаг захиргаанд хуваасан ба Хархорум дахь төв байр нь Монгол, Манжуур, Сибирийн асуудлыг шууд хариуцдаг байв. Түүний хаанчлалын сүүл үед Амударьягийн захиргаа байгуулагдсан байна. Туркестаныг Махмуд Ялавач захирч байсан бол Елюй Чуцай 1229-1240 оны үед Хойд Хятадыг захирч байлаа. Өгэдэй Шигихутугийг Хятадад ерөнхий шүүгчээр томилжээ. Иранд Өгэдэй эхлээд хар хятан хүн Чинтөмөрийг, дараа нь шударга захирагч гэдгээ харуулсан уйгур хүн Коргузыг томилов. Хожим Елюй Чуцайн зарим үүргийг Махмуд Ялавачид шилжүүлж, албан татварыг Абдурахманд хүлээлгэн өгчээ. Абдурахман татварын нэг жилийн мөнгөн орлогын хэмжээг хоёр дахин нэмэгдүүлнэ гэж амласан байна. Ортог буюу түнш худалдаачид Өгэдэйн мөнгийг тариачдад хэт өндөр хүүтэй зээлүүлж байсан хэдий ч Өгэдэй өөрөө нэлээд өндөр хүүтэй зээл авдаг байжээ. Энэ нь ашигтай байсан авч олон хүн татвар хураагчид болон тэдний хүчтэй зэвсэгт бүлэглэлүүдээс зайлсхийхийн тулд гэр орноо орхин дүрвэжээ."
6fe272753a2b82b1,mn,蒙古语,mn.wikipedia.org 主要为西里尔蒙古文，非传统竖排蒙古文,wikipedia_api,Өгэдэй хаан,1914,30,655,0.8519,0.0,0.0,https://mn.wikipedia.org/wiki/%D3%A8%D0%B3%D1%8D%D0%B4%D1%8D%D0%B9_%D1%85%D0%B0%D0%B0%D0%BD,"Өгэдэй эзэнт гүрний ноёдод христийн шашинт бичээч Кадак, даосын шашны санваартан Ли Чжичан нараар хичээл заалгаж, сургууль, академи байгуулж байв. Мөн Өгэдэй хаан торгоны нөөцөөр баталгаажсан цаасан мөнгөн тэмдэгт гаргах зарлиг буулгаж, хуучин мөнгөн дэвсгэртийг устгах үүрэгтэй газар байгуулжээ. Елюй Чуцай Өгэдэйн Иран, Баруун болон Хойд Хятад, Хорезм зэрэг хараат газар нутгийг өргөн хэмжээгээр хувааж байгаа явдлыг эзэнт гүрнийг задралд хүргэж болзошгүй хэмээн эсэргүүцэж байлаа. Ийнхүү Өгэдэйн зарлиг болгосноор Монголын язгууртнууд хараат газар нутгуудад даргач томилж болох боловч хааны ордноос бусад албан тушаалтныг томилж, татвар авахаар болжээ."
770f4666c16e0b9c,mn,蒙古语,mn.wikipedia.org 主要为西里尔蒙古文，非传统竖排蒙古文,wikipedia_api,Өгэдэй хаан,1914,31,1070,0.8262,0.0,0.0,https://mn.wikipedia.org/wiki/%D3%A8%D0%B3%D1%8D%D0%B4%D1%8D%D0%B9_%D1%85%D0%B0%D0%B0%D0%BD,"Өгэдэй хаан эцгийнхээ тушаал, зарлигууд хүчин төгөлдөр хэвээр байгааг баталж, дээр нь өөрийн зарлигийг нэмж, ""Их Засаг"" (""Их Яса"" гэж бас нэрлэдэг) хуулийг үүний салшгүй нэгэн хэсэг хэмээн тунхагласан байна. Өгэдэй хуралдай явуулах болон хувцаслалтын дүрмийг хуульчилсан юм. Тэрээр 1234 онд замын дагуу элч зарлагуудын хэрэгцээг хангах байнгын хүмүүс бүхий өртөөнүүд (яам) байгуулжээ. 25 мил тутамд буухиа өртөөнүүдийг байгуулсан ба өртөөний хүмүүс элч нарт морь унаа өгч, тогтоосон хоол ундаар үйлчилдэг байв. Өртөөнд хавсаргасан айл өрхүүд бусад албан татвараас чөлөөлөгдсөн байсан ч өртөө улаа залгуулахын тулд гувчуур татвар төлөх ёстой байлаа. Өгэдэй Цагадай, Бат хоёрыг өөрсдийн өртөөнүүдээ тус тусдаа хянан захирахыг тушаажээ. Мөн Өгэдэй хаан язгууртнуудыг пайз (энгийн ард түмнээс хэрэгцээт зүйлс, үйлчилгээ шаардах эрх мэдэл бүхий тэмдэг) болон зарлиг гаргахыг хориглов. Бас Өгэдэй зарлиг буулгаж аравт бүрд 100 хониноос нэгийг авч тухай тухайн аравтын дотор буй ядууст өгөх ба сүрэг бүрээс нэг хонь, нэг гүү авч эзэн хааны зоог шүүсэнд хэрэглүүлэхээр болгожээ."
dc249d40605b3498,mn,蒙古语,mn.wikipedia.org 主要为西里尔蒙古文，非传统竖排蒙古文,wikipedia_api,Өгэдэй хаан,1914,32,1117,0.829,0.0,0.0,https://mn.wikipedia.org/wiki/%D3%A8%D0%B3%D1%8D%D0%B4%D1%8D%D0%B9_%D1%85%D0%B0%D0%B0%D0%BD,"Өгэдэй 1235-1238 оны үед Монголын төв нутгаар дамжин өнгөрдөг жил бүрийн нүүдлийн замынхаа буудаллан саатах газруудад хэд хэдэн ордон, асар барьжээ. Анхны ордон ""Ваньнянгун""-ыг (""Түмэн амгалант ордон"") Хойд Хятадын гар урчууд барьсан байна. Их Хаан өөрийн хамаатан садангууддаа ойр орчимд нь ордон сууц барихыг уриалж байсан ба Хятадаас авчирсан гар урчуудыг уг газрын ойролцоо суурьшуулжээ. 1235 онд Хархорум хотын бүтээн байгуулалт дуусаж, Өгэдэйн ивээлийг хүртэхийн төлөө өрсөлдөж байсан Лалын болон Хойд Хятадын гар урчуудыг хотын өөр өөр хэсгүүдэд хуваарилан байршуулав. Хотыг дөрвөн хаалгатай шороон хэрэм хүрээлж байлаа. Хотод хавсарсан хувийн орон сууцууд байсан ба урд талд нь Зүүн Азид түгээмэл хэрэглэгддэг сийлбэртэй багана бүхий аварга том чулуун яст мэлхий зогсож байв. Мөн цэцэрлэгийн хаалгатай адил хаалгануудтай цайз шилтгээн болон олон тооны усны шувууд цугларсан хиймэл нуурууд байжээ. Бас Өгэдэй будда, лал, даос, христ шашинтнуудад зориулан хэд хэдэн мөргөлийн сүм бариулсан аж. Хятадуудын оршин суух тойрогт Елюй Чуцайн хятад загвараар хуанли зохиож, зохицуулалт хийдэг күнзийн суртлын сүм байв."
239c6d787027cf80,mn,蒙古语,mn.wikipedia.org 主要为西里尔蒙古文，非传统竖排蒙古文,wikipedia_api,Өгэдэй хаан,1914,33,567,0.8466,0.0,0.0,https://mn.wikipedia.org/wiki/%D3%A8%D0%B3%D1%8D%D0%B4%D1%8D%D0%B9_%D1%85%D0%B0%D0%B0%D0%BD,"Өгэдэйг хүүхэд байхаас нь эцгийнх нь хайртай хүү гэж авч үздэг байв. Тэрээр насанд хүрсэн хойноо аливаа мэтгэлцээнд оролцохдоо эргэлзэгчдийг зүгээр л өөрийн хувийн зан чанарын хүчээр няцаах чадвараараа алдартай байжээ. Өгэдэй бие бялдарын хувьд том, хөгжилтэй, сэтгэл татам хүн байв. Тэрээр ихэнхдээ цагийг сайхан өнгөрүүлэх сонирхолтой байсан бололтой. Тэр ухаалаг, тогтвортой зан чанартай байлаа. Өгэдэйн удирдахуйн авъяас билэг нь эцгийнхээ тогтоосон зам дээрх Монголын эзэнт гүрнийг хэвээр нь авч үлдсэн түүний амжилтад тодорхой хэмжээний байр суурь эзэлж байсан."
5e7a58301f3c1f19,mn,蒙古语,mn.wikipedia.org 主要为西里尔蒙古文，非传统竖排蒙古文,wikipedia_api,Өгэдэй хаан,1914,34,337,0.8338,0.0,0.0,https://mn.wikipedia.org/wiki/%D3%A8%D0%B3%D1%8D%D0%B4%D1%8D%D0%B9_%D1%85%D0%B0%D0%B0%D0%BD,1232 онд Толуй гэнэт нас барсан явдал нь Өгэдэйд гүн нөлөөлсөн бололтой. Зарим эх сурвалжийн мэдээлснээр Толуй өвчинд шаналж байсан Өгэдэйг аврахын тулд бөө мөргөлийн зан үйлээр хордуулсан ундаа ууж амиа золиосолжээ. Бусад эх сурвалжид Өгэдэй бөө нарын тусламжтайгаар архичин Толуйд хар тамхи татуулж амийг нь хороосон гэж бичсэн байдаг.
8663a834d8fbe02c,mn,蒙古语,mn.wikipedia.org 主要为西里尔蒙古文，非传统竖排蒙古文,wikipedia_api,Өгэдэй хаан,1914,35,620,0.8371,0.0,0.0,https://mn.wikipedia.org/wiki/%D3%A8%D0%B3%D1%8D%D0%B4%D1%8D%D0%B9_%D1%85%D0%B0%D0%B0%D0%BD,"Өгэдэй архинд донтсон гэдгээрээ алдартай нэгэн байв. Цагадай зуршлыг нь харж хянаж байхыг түшмэлдээ даалгасан боловч Өгэдэй ямар нэгэн аргаар үргэлжлүүлэн уусаар байжээ. Нийтэд тархсан таамгаар бол Өгэдэй өдөрт уудаг аяганыхаа тоог цөөлөх тангараг тавьж, дараа нь хувийн хэрэгцээндээ зориулж ерийн аяганаас хоёр дахин том аяга хийлгэсэн ажээ. Тэрээр Абдурахмантай шөнийн турш архидсаныхаа дараа 1241 оны 12-р сарын 11-ний үүрээр нас барахад хүмүүс Толуйн бэлэвсэн эхнэрийн эгч, Абдурахман хоёрыг буруутгаж байв. Харин Монголын язгууртнууд хаан өөрийгөө хянах чадвар дутмаг байснаас амиа алдсан гэдгийг хүлээн зөвшөөрсөн."
5d6db41509b017e2,mn,蒙古语,mn.wikipedia.org 主要为西里尔蒙古文，非传统竖排蒙古文,wikipedia_api,Өгэдэй хаан,1914,36,854,0.8454,0.0,0.0,https://mn.wikipedia.org/wiki/%D3%A8%D0%B3%D1%8D%D0%B4%D1%8D%D0%B9_%D1%85%D0%B0%D0%B0%D0%BD,"Өгэдэй бас даруухан, өөрийгөө суут ухаантан гэж итгэдэггүй хүн байсан ба эцгийнхээ үлдээсэн агуу жанжид, мөн өөрийн чадварлаг гэж үзсэн хүмүүсийн үгийг сонсох, хэрэглэхэд бэлэн байдаг байв. Тэр эзэн хаан байсан ч дарангуйлагч биш байлаа. Өгэдэй өөрийн үеийн бүх монголчуудын нэгэн адил багаасаа дайчин болж хүмүүжсэн бөгөөд Чингис хааны хүүгийн хувьд дэлхийн эзэнт гүрэн байгуулах эцгийнхээ төлөвлөгөөний нэг хэсэг байсан юм. Түүний цэргийн туршлага нь жанждынхаа үгийг сонсох, нөхцөл байдалд дасан зохицоход бэлэн байдгаараа онцлог байв. Тэрээр аавтайгаа адилхан прагматик хүн байсан бөгөөд арга хэрэгсэл гэхээсээ илүү төгсгөлийг нь хардаг байжээ. Өгэдэйн тууштай зан чанар, найдвартай байдал нь аавынх нь хамгийн их үнэлдэг зан чанар байсан ба энэ нь түүнийг хоёр ахтай байсныг үл харгалзан эцгийнхээ залгамжлагчийн үүргийг хүлээн авахад хүргэсэн ажээ."
5205b8dc38cda029,mn,蒙古语,mn.wikipedia.org 主要为西里尔蒙古文，非传统竖排蒙古文,wikipedia_api,Өгэдэй хаан,1914,37,1027,0.8354,0.0,0.0,https://mn.wikipedia.org/wiki/%D3%A8%D0%B3%D1%8D%D0%B4%D1%8D%D0%B9_%D1%85%D0%B0%D0%B0%D0%BD,"Гэсэн хэдий ч Монгол, Персийн түүхчид Өгэдэйг 1237 онд эцэг Чингис хааныхаа бага насны охидыг булаан авах, хүчиндэх, хулгайлах, солилцох, худалдахыг хориглосон болон хэдийгээр охид бага залуу насандаа гэрлэж болох ч 16 нас хүртлээ бэлгийн харьцаанд орохгүй байх тухай хууль тогтоомжуудыг зөрчсөн хэмээн шүүмжилдэг. Монгол түүхүүдэд гэмт хэргийн мөн чанарын талаар тодорхой тэмдэглээгүй байдаг ч Персийн түүхчид ойрадууд Өгэдэйн гаремд охид явуулахаа больсны дараа Өгэдэй долоогоос дээш насны 4,000 ойрад охидыг хамаатан садных нь нүдэн дээр цэргүүдээрээ нүцгэлүүлж, олон удаа хүчиндэж байсан гэж тэмдэглэсэн байдаг. Эдгээр охидоос хоёр нь зовлон зүдгүүрийн улмаас нас барсан ба хүчирхийлэлд өртөөгүй үлдсэн охидыг цэргүүд хуваан авч, зарим охидыг хааны гарем руу явуулж, заримыг нь бэлгийн боолчлолын зорилгоор аяны буудлуудад хуваарилжээ. Үүнд тохиромжгүй гэж үзсэн бусад охидыг авч явах юм уу хөсөр хаясан байна. Өгэдэй энэ алхмыг бэлгийн завхралд автсандаа биш, харин Ойрад дахь эрх мэдлээ бэхжүүлэхийн тулд хийсэн бололтой."
49b0559f32ab664d,mn,蒙古语,mn.wikipedia.org 主要为西里尔蒙古文，非传统竖排蒙古文,wikipedia_api,Өгэдэй хаан,1914,38,2006,0.7368,0.0,0.0788,https://mn.wikipedia.org/wiki/%D3%A8%D0%B3%D1%8D%D0%B4%D1%8D%D0%B9_%D1%85%D0%B0%D0%B0%D0%BD,"Дээрх мэдээ, тухайлбал монгол сурвалжид уг гэмт хэргийг шүүмжилсэн (одоо ч эргэлзээтэй) гэсэн таамаглалыг Жек Уэзерфордын (Jack Weatherford) 2011 онд хэвлэгдсэн ""Монгол хатдын нууц түүх: Чингис хааны охид түүний эзэнт гүрнийг хэрхэн аварсан бэ?"" (""The Secret History of the Mongol Queens: How the Daughters of Genghis Khan Rescued His Empire"") номд (энэ ном монгол хэлээр ""Монголын Их Хатдын нууц товчоо: Чингис хааны эзэнт гүрнийг охид нь аварч хамгаалсан түүх"" хэмээх нэртэйгээр орчуулагдсан) дурдсан байдаг. Уэзерфорд үүнийг ""түүний (Өгэдэйн) 12 жилийн хаанчлалын үеийн хамгийн аймшигт гэмт хэрэг бөгөөд Монголын түүхэнд тэмдэглэгдсэн хамгийн аймшигт харгислалын нэг"" гэж нэрлэжээ. Анна Ф.Бродбрижийн (Anne F. Broadbridge) бичсэн ""Эмэгтэйчүүд ба Монголын эзэнт гүрний бүтээн байгуулалт"" (""Women and the Making of the Mongol Empire"") хэмээх Монголын түүх судлалын сүүлийн үеийн номд (энэ ном 2018 онд хэвлэгдсэн) ""Ойрад охидыг олноор нь хүчирхийлсэн гэх гутамшигт хэрэг""-ийг Өгэдэй өөрийн авга ах Тэмүгэ отчигины нутаг дэвсгэрээс охидыг Тэмүгэгийн зөвшөөрөлгүйгээр хураан авсан явдалтай холбосон байдаг. Гэсэн хэдий ч Бродбриж ""Бүх нотлох баримт дарагдсан тул энэ нь зөвхөн таамаглал байж болно"" гэж тэмдэглэжээ. ""Юань улсын судар"" болон ""Монголын нууц товчоо""-д Өгэдэй ""зүүн жигүүр"" болон ""авга ах Отчигины эзэмшил""-ээс эмэгтэйчүүдийг хүчээр булааж авсан тухай өгүүлдэг боловч хүчингийн тухай дурдаагүй байдаг. ""Монголын нууц товчоо""-д Өгэдэй хийсэн үйлдэлдээ харамсаж буйгаа илэрхийлж ""Миний хоёр дахь буруу, зарчимгүй эм хүний үгийг сонсож, миний авга ах Отчигины нутгаас охидыг надад авчирсан нь гарцаагүй алдаа байсан"" (""Нөгөө буруу ёс үгүй эм хүний үгд орж Отчигин авгын улсын охид авчруулах алжаас болов зэ. Улсын эзэн хаан бөгөөтөл ёс үгүй алжаас үйлд дөлэсгэгү (түлэсгэх) минь нэгэн буруу энэ болов зэ"") гэж хэлсэн тухай өгүүлсэн байдаг ч Игорь де Рахвельц (Igor de Rachewiltz) дөрвөн сайн үйл, дөрвөн алдааг жагсаасан бүх догол мөр нь Өгэдэйн нас барсны дараах үнэлгээ байж болохыг тэмдэглэжээ."
a5af1b5b62932779,mn,蒙古语,mn.wikipedia.org 主要为西里尔蒙古文，非传统竖排蒙古文,wikipedia_api,Өгэдэй хаан,1914,39,2048,0.79,0.0,0.0205,https://mn.wikipedia.org/wiki/%D3%A8%D0%B3%D1%8D%D0%B4%D1%8D%D0%B9_%D1%85%D0%B0%D0%B0%D0%BD,"Хүчингийн гэмт хэрэг үйлдсэн гэх цорын ганц мэдээлэл нь Жувейнийн (1226-1283) 1252 онд бичсэн ""Дэлхийг байлдан дагуулагчийн түүх""-ийн (""Tarikh-i Jahangushay"") 32-р бүлэгт байдаг. Энэ бүлгийг хожим Рашид ад-Дин XIV зууны эхэн үед бүтээсэн ""Судрын чуулган"" (""Jami' al-Tawarikh"") номдоо бүхэлд нь үгчлэн хуулбарласан хэдий ч бага зэрэг товчилсон хувилбараар бичжээ. Жувейни номынхоо 32-р бүлэгт Өгэдэй хааныг магтан дуулж эхлээд Өгэдэйн ""энэрэл, өршөөл, шударга чанар, өгөөмөр зан""-г харуулахын тулд маш нарийн 50 анекдот (Бодит үйл явдал, эсвэл хүний тухай богино, хөгжилтэй юм уу сонирхолтой түүх) өгүүлж, дараа нь түүний ""уур хилэн, хатуу чанд төлөв, догшин ширүүн зан, аймшиг төрүүлсэн байдал""-ыг харуулах нэг анекдот өгүүлсэн ба энэхүү нэг анекдот нь дээр дурдсан хүчингийн хэргийн тухай юм. Энэхүү анекдот энэ бүлгийг төгсгөж байна. Жувейнийн хоёр гар бичмэлд уг хүчирхийлэлд өртсөн овог аймгийн нэр тодорхой байдаггүй ч D гар бичмэл болон Рашид ад-Дин нар ""Ойрад"" гэж бичжээ. Бродбриж, И. де Рахвельц нар ойрадуудтай холбосон энэ тодорхойлолтын үнэн бодит эсэхэд эргэлзэж байв. Анекдотуудыг перс үлгэрийн хэв маягаар бичсэн байна. Жувейни 46-р анекдотын эх сурвалжийн тухай ""Миний тааламжтай яриа өрнүүлдэг найзуудын нэг надад дараах түүхийг хэлсэн юм"" гэж тэмдэглэжээ. Өгэдэйг магтан дуулсан анекдотууд нь лалын шашинтнуудыг дэмжигч, хятадуудын эсрэг байр суурийг илэрхийлдэг. Хэд хэдэн анекдот Өгэдэйн өөрийгөө хянах чадвар дутмаг байдлыг харуулсан доог тохууны өнгө аястай байдаг. Анекдотууд нь үнэний ортой байж болох ч зарим нь лал худалдаачдын нийгэмлэгээс гаралтай хуурамч домог мэт санагддаг тул болгоомжтой хандах хэрэгтэй. Перс хэл дээрх өөр нэг мэдээ бол ""монголчуудыг шоолж"", ""хорон муу санаа""-гаа илэрхийлснийх нь төлөө Алтан улсын цэргүүдийг бөөнөөр нь ""содом""-дох (""sodomy"" (""содоми"") - ижил хүйстний бэлгийн харилцаа) буюу хүчирхийлж байсан явдал юм. Үүнийг Рашид ад-Дин эш татсан бөгөөд Уэзерфорд тэмдэглэжээ. Хэдийгээр энэ мэдээ нь хэтрүүлэгтэй байж болох ч бэлгийн хүчирхийллийг зэвсэг болгон ашиглаж байгааг харуулсан байна."
